reviewer_id,store_name,category,store_address,latitude ,longitude,rating_count,review_time,review,rating;
"Had a Uber delivery pick up at this Same location! got the Uber pick and still waited for food while it sat there and I asked my number 228 and got it! It had no cheese! I told the manager and they took my sandwich and slap cold cheeze on it! I addressed it and they were willing to change it but I had (their ) Uber delivery customer waiting in hand and I couldnï¿½ï¿½ï¿½ï¿½ï¿½ï¿½ï¿½ï¿½ï¿½ï¿½ï¿½ï¿½ï¿½ï¿½ï¿½ï¿½ï¿½ï¿½ï¿½ï¿½ï¿½ï¿½ï¿½ï¿½ï¿½ï¿½ï¿½t wait for mine to be prepared while the customers food got cold! I said I would be back with them knowing me ! Came back the Manager gave me the same food that was sitting there 3 deliveries,50min later and said I should have waited and if I want it or my money back while Iï¿½ï¿½ï¿½ï¿½ï¿½ï¿½ï¿½ï¿½ï¿½ï¿½ï¿½ï¿½ï¿½ï¿½ï¿½ï¿½ï¿½ï¿½ï¿½ï¿½ï¿½ï¿½ï¿½ï¿½ï¿½ï¿½ï¿½m trying to address whatï¿½ï¿½ï¿½ï¿½ï¿½ï¿½ï¿½ï¿½ï¿½ï¿½ï¿½ï¿½ï¿½ï¿½ï¿½ï¿½ï¿½ï¿½ï¿½ï¿½ï¿½ï¿½ï¿½ï¿½ï¿½ï¿½ï¿½s wrong about all this behavior handling food! Her Name is Alba she saidis! I would say I wonï¿½ï¿½ï¿½ï¿½ï¿½ï¿½ï¿½ï¿½ï¿½ï¿½ï¿½ï¿½ï¿½ï¿½ï¿½ï¿½ï¿½ï¿½ï¿½ï¿½ï¿½ï¿½ï¿½ï¿½ï¿½ï¿½ï¿½t be eating from here anymo"",1 star";
"1849,McDonald's,Fast food restaurant,""72-69 Kissena Blvd, Queens, NY 11367, United States"",40.7274006,-73.8124604,""2,193"",a month ago,""Food are ok(typically mc), service are good but They don't allow scooter get in."",4 stars";
"1850,McDonald's,Fast food restaurant,""72-69 Kissena Blvd, Queens, NY 11367, United States"",40.7274006,-73.8124604,""2,193"",6 months ago,Just recent some girl was in lobby while kids went crazy in lobby .She came with purpose but as an older person made me feel good asking them please to calm a bit spread out they moved belongings closer not all over cleaned Think name was stacie I saw . After school gets crowded good to see someone proud to help along with guard who seems busy at time .all over great service for busy place.,3 stars";
"1851,McDonald's,Fast food restaurant,""72-69 Kissena Blvd, Queens, NY 11367, United States"",40.7274006,-73.8124604,""2,193"",3 months ago,Been coming to this mcdees since 1988 when they had a hamburgler jail and a big yellow slide out in the open. But lately they've had a hard time getting orders right.,4 stars";
"1852,McDonald's,Fast food restaurant,""72-69 Kissena Blvd, Queens, NY 11367, United States"",40.7274006,-73.8124604,""2,193"",5 months ago,Horrible customer service. They treat Uber/Doordash like they are less than. Really bad. If McDs gonna take these delivery orders they should hire enough people to have them ready not leave a crowd of guys waiting for their deliveries. Unacceptable!,1 star";
"1853,McDonald's,Fast food restaurant,""72-69 Kissena Blvd, Queens, NY 11367, United States"",40.7274006,-73.8124604,""2,193"",3 weeks ago,Going off uber eats order. Orders a large meal..no fries or mac sauce that I paid extra for. Called twice goes to voice-mail.,3 stars";
"1854,McDonald's,Fast food restaurant,""72-69 Kissena Blvd, Queens, NY 11367, United States"",40.7274006,-73.8124604,""2,193"",2 weeks ago,Here's the flag they currently fly (June 2023) to honor our brothers and sisters who lost their lives defending us.,4 stars";
"1855,McDonald's,Fast food restaurant,""72-69 Kissena Blvd, Queens, NY 11367, United States"",40.7274006,-73.8124604,""2,193"",6 months ago,Mmmm to be honest they are pretty fast with their drive-by  orders I cannot complain but they run out of the special items and Frappuccinos pretty fast. Overall food quality is pretty much always fresh!,4 stars";
"1856,McDonald's,Fast food restaurant,""72-69 Kissena Blvd, Queens, NY 11367, United States"",40.7274006,-73.8124604,""2,193"",8 months ago,""They have good people working here. The workers won't just let you stand there waiting. They always see people standing there and ask """"what is your order number?"""" and then go look for it. For super fast service DL the mobile app and order/pay online."",5 stars";
"1857,McDonald's,Fast food restaurant,""72-69 Kissena Blvd, Queens, NY 11367, United States"",40.7274006,-73.8124604,""2,193"",7 months ago,""Is this close to a school? Lots of noisy teenagers hanging around here. Other than that it has an interesting seating arrangement. Just come at a slower time if you plan to enjoy your meal/snack dining in. I do notice the regular pricing is higher than nearby McDonald's. There is lots of curbside pickup parking, drive thru often busy. Ask for ketchup and sauce, they never give it by default."",5 stars";
"1858,McDonald's,Fast food restaurant,""72-69 Kissena Blvd, Queens, NY 11367, United States"",40.7274006,-73.8124604,""2,193"",3 months ago,""No good service! They took my recipe, and I ask salt on my french fries, and they give me hot pepper. The old lady's Attitude is imperious!!! ï¿½ï"",1 star";
"1859,McDonald's,Fast food restaurant,""72-69 Kissena Blvd, Queens, NY 11367, United States"",40.7274006,-73.8124604,""2,193"",3 months ago,I ordered a 20-piece nugget and only got 18 nuggets. Food was nice and hot though,2 stars";
"1860,McDonald's,Fast food restaurant,""72-69 Kissena Blvd, Queens, NY 11367, United States"",40.7274006,-73.8124604,""2,193"",6 months ago,""Terrible Service!, You place and pay for your order, and then wait forever to get your food, very very slow. Walk in or Drive thru, both are awful!, If you Drive thru, you order and pay, then you wait forever to get your food. Walk in just as slow. Management very inconsiderate of their customers. Please go someplace else!"",1 star";
"1861,McDonald's,Fast food restaurant,""72-69 Kissena Blvd, Queens, NY 11367, United States"",40.7274006,-73.8124604,""2,193"",2 weeks ago,I did the Drive though the food was warm and it was turn off .,2 stars";
"1862,McDonald's,Fast food restaurant,""72-69 Kissena Blvd, Queens, NY 11367, United States"",40.7274006,-73.8124604,""2,193"",4 months ago,""lousy service, customers ask and no one answers, they are rude and make the food in a bad way.  lousy!  lousy!  the worst experience."",1 star";
"1863,McDonald's,Fast food restaurant,""72-69 Kissena Blvd, Queens, NY 11367, United States"",40.7274006,-73.8124604,""2,193"",a month ago,I placed an order and got charge i show my receipt to the manager she didnï¿½ï¿½ï¿½ï¿½ï¿½ï¿½ï¿½ï¿½ï¿½ï¿½ï¿½ï¿½ï¿½ï¿,1 star";
"1864,McDonald's,Fast food restaurant,""72-69 Kissena Blvd, Queens, NY 11367, United States"",40.7274006,-73.8124604,""2,193"",8 months ago,""It is really clean, employee Joel keeps it super clean in the morning shift. But they never seem to get the order right. Then I have to go back and get it corrected. Like it be clear on the receipt and they still mess it up! The staff overall is professional and nice."",3 stars";
"1865,McDonald's,Fast food restaurant,""72-69 Kissena Blvd, Queens, NY 11367, United States"",40.7274006,-73.8124604,""2,193"",a year ago,""Terrible mc Donaldï¿½ï¿½ï¿½ï¿½ï¿½ï¿½ï¿½ï¿½ï¿½ï¿½ï¿½ï¿½ï¿½ï¿½ï¿½ï¿½ï¿½ï¿½ï¿½ï¿½ï¿½ï¿½ï¿½ï¿½ï¿½ï¿½ï¿½s. So disappointed. I hope they make some changes and teach employees to f"",1 star";
"1866,McDonald's,Fast food restaurant,""72-69 Kissena Blvd, Queens, NY 11367, United States"",40.7274006,-73.8124604,""2,193"",2 months ago,""The food tasted fresh. I asked for mac sauce on my burger, but instead, I got a bunch of ketchup."",3 stars";
"1867,McDonald's,Fast food restaurant,""72-69 Kissena Blvd, Queens, NY 11367, United States"",40.7274006,-73.8124604,""2,193"",7 months ago,""Decent McDonalds, but I would prefer avoiding this one, especially at certain times (after school hours. Lunch maybe? And some evenings) it is packed with unbearably loud and annoying kids, teens, sometimes even adults. There are some nice employees, but the order is always wrong.";
"Food is consistently good though."",2 stars";
"1868,McDonald's,Fast food restaurant,""72-69 Kissena Blvd, Queens, NY 11367, United States"",40.7274006,-73.8124604,""2,193"",6 months ago,""Do not order from this place unless you are In person. They just messed up my order and didn't give all items that I paid for. Waste of a delivery especially when all items are not included,  1 person has food..smh"",1 star";
"1869,McDonald's,Fast food restaurant,""72-69 Kissena Blvd, Queens, NY 11367, United States"",40.7274006,-73.8124604,""2,193"",a month ago,Great staff members clean and little wait time,5 stars";
"1870,McDonald's,Fast food restaurant,""72-69 Kissena Blvd, Queens, NY 11367, United States"",40.7274006,-73.8124604,""2,193"",6 months ago,Always come here but today I went thru the drive through and encountered a woman who looked like a manager training a young man or something like that. Both of them extremely rude and condescending. 11/17/22 9:26am transaction amount 4.24 side one,1 star";
"1871,McDonald's,Fast food restaurant,""72-69 Kissena Blvd, Queens, NY 11367, United States"",40.7274006,-73.8124604,""2,193"",2 months ago,Fast and clean. Good parking and area. Why not.,5 stars";
"1872,McDonald's,Fast food restaurant,""72-69 Kissena Blvd, Queens, NY 11367, United States"",40.7274006,-73.8124604,""2,193"",a month ago,""It might be a one time thing food was not good";
"I eat from McDonald a lot itï¿½ï¿½ï¿½ï¿½ï¿½ï¿½ï¿½ï¿½ï¿½ï¿½ï¿½ï¿½ï¿½ï¿½ï"",1 star";
"1873,McDonald's,Fast food restaurant,""72-69 Kissena Blvd, Queens, NY 11367, United States"",40.7274006,-73.8124604,""2,193"",a year ago,Always very disappointing. I've gone to this McDonald's for 15 years now. The system has gotten more organized since the recent renovation but it seems the efficiency still has not improved. The workers are nice and willing to help. The seating area is much better. The biggest issue would be the lack of efficient service. I've seen people leave after ordering because it would take so long. Hopefully it'll be improved.,2 stars";
"1874,McDonald's,Fast food restaurant,""72-69 Kissena Blvd, Queens, NY 11367, United States"",40.7274006,-73.8124604,""2,193"",9 months ago,""Easy to pick up my mobile orders. They have soda machines so you don't have to worry about specifying no ice in drinks. They include napkins, straw, and lids. Straws have either been paper or plastic. They do not include ketchup packets, so you have to ask counterstaff. $1 drinks is a perk that no other fast food restaurant has. The dining room has plentiful tables and chairs too, ranging from booths to high stools to couch-like chairs. Easy to get there by Q25 or Q34. Not very close to any subway stations."",4 stars";
"1875,McDonald's,Fast food restaurant,""72-69 Kissena Blvd, Queens, NY 11367, United States"",40.7274006,-73.8124604,""2,193"",a month ago,Food was hot.  Service was fast and pleasant.,5 stars";
"1876,McDonald's,Fast food restaurant,""72-69 Kissena Blvd, Queens, NY 11367, United States"",40.7274006,-73.8124604,""2,193"",a year ago,Everyone walking around and noone helping with doordash everï¿½ï¿½ï¿½ï¿½ï¿½ï¿½ï¿½ï¿½ï¿½ï¿½ï¿½ï¿½ï¿½ï¿½ï¿½ï¿½ï¿½ï¿½ï¿½ï¿½ï¿½ï,1 star";
"1877,McDonald's,Fast food restaurant,""72-69 Kissena Blvd, Queens, NY 11367, United States"",40.7274006,-73.8124604,""2,193"",a year ago,""I ordered three items and i just got two";
"This is not the first time when i pay for stuff and i dont get it - and I discovered it after i be at my home . Is that how you save money !?"",1 star";
"1878,McDonald's,Fast food restaurant,""72-69 Kissena Blvd, Queens, NY 11367, United States"",40.7274006,-73.8124604,""2,193"",10 months ago,""The regular parking spots were taken, but there was ample mobile order curbside service parking. I'd never ordered that way before, but it was for take out anyway. An employee delivered the food within 5 minutes of placing the order. Overall it was a good experience."",5 stars";
"1879,McDonald's,Fast food restaurant,""72-69 Kissena Blvd, Queens, NY 11367, United States"",40.7274006,-73.8124604,""2,193"",9 months ago,""The drive thru is not open 24 hrs. Theres nothing worse than driving to a location advertising being open only to get there and see the cleaning person ignore you as you try to ask for the hours.";
;
"Edit: finally was able to get the attention of an employee who says they close from 4am to 5:30am"",1 star";
"1880,McDonald's,Fast food restaurant,""72-69 Kissena Blvd, Queens, NY 11367, United States"",40.7274006,-73.8124604,""2,193"",2 years ago,Today july 31st 2020. 2:00pm. Just get the burger from this mcdonald. See what they give it to me. A piece spit meat. Nice job,1 star";
"1881,McDonald's,Fast food restaurant,""72-69 Kissena Blvd, Queens, NY 11367, United States"",40.7274006,-73.8124604,""2,193"",a month ago,I used the curb side feature. It's excellent,5 stars";
"1882,McDonald's,Fast food restaurant,""72-69 Kissena Blvd, Queens, NY 11367, United States"",40.7274006,-73.8124604,""2,193"",2 months ago,Ordered a filet o fish. Didn't put tartar sauce on my sandwich,1 star";
"1883,McDonald's,Fast food restaurant,""72-69 Kissena Blvd, Queens, NY 11367, United States"",40.7274006,-73.8124604,""2,193"",a year ago,How could u give me the wrong order?????I order the blueberry pie and u give me some holiday pie????or u just donï¿½ï¿½ï¿½ï¿½ï¿½ï¿½ï¿½ï¿½ï¿½ï¿½ï¿½ï¿½ï¿½ï¿½ï¿½ï¿½ï¿½ï¿½ï¿½ï¿½ï¿½ï¿½ï¿½ï¿½ï¿½ï¿½ï¿½t have the pie????an,1 star";
"1884,McDonald's,Fast food restaurant,""72-69 Kissena Blvd, Queens, NY 11367, United States"",40.7274006,-73.8124604,""2,193"",9 months ago,""The food was top notch and very enjoyable, the inside of the place is above average in size and variety if seats and tables. Customer service was amazing and the place has multiple places to order in their drive through for multiple people at once."",5 stars";
"1885,McDonald's,Fast food restaurant,""72-69 Kissena Blvd, Queens, NY 11367, United States"",40.7274006,-73.8124604,""2,193"",10 months ago,dammmm evrytime I go there they have attitude problem they forgot to give me fries with my orders when I went back and tolled them that I was missing 2 orders of fries they gave me an attitude like I was asking for  $1000 I payed for it like dammmm it's not like I wanted to go back at 12:30 am just for those measly fries my kids was craving it so that's the only reason I went back . They really need to hire new stuff more who is more pleasant and polite,1 star";
"1886,McDonald's,Fast food restaurant,""72-69 Kissena Blvd, Queens, NY 11367, United States"",40.7274006,-73.8124604,""2,193"",6 months ago,""Service was terrible I had to wait for ever to get my food, then when I finally did it was a security guard who gave it to me that was behind the counter for what ever reason he didn't have on gloves he put his dirty finger in my cup when he pulled it out the group of cups I won't be going back to this location the staff speaks spenglish I can barely understand what they trying to say I didn't get sauce for my biggest it's just terrible service on top of the 75 school kids in there standing around waiting for their orders"",1 star";
"1887,McDonald's,Fast food restaurant,""72-69 Kissena Blvd, Queens, NY 11367, United States"",40.7274006,-73.8124604,""2,193"",4 months ago,Ordered Uber Eats. No drinks or cookies were in my order. Cold food.,2 stars";
"1888,McDonald's,Fast food restaurant,""72-69 Kissena Blvd, Queens, NY 11367, United States"",40.7274006,-73.8124604,""2,193"",a month ago,""Too many noisy homeless gangsters there, making me very uncomfatable!"",1 star";
"1889,McDonald's,Fast food restaurant,""72-69 Kissena Blvd, Queens, NY 11367, United States"",40.7274006,-73.8124604,""2,193"",a year ago,""In store experience is generally better than delivery. Order breakfast for my whole family, all that was delivered was 2 orange juices. When I asked the driver he said he even asked if there was any food and stated the employee said no. Not sure who would only order orange juices, for the trouble and price the corner store juice is way better. Deliveries need to be handled better, not the first time missing items or a whole order."",2 stars";
"1890,McDonald's,Fast food restaurant,""72-69 Kissena Blvd, Queens, NY 11367, United States"",40.7274006,-73.8124604,""2,193"",a year ago,""There is a major problem with this McDonald's!! I have been coming here for years, and I put up with alot of inconveniences! Non the less, last night was appalling!! What's wrong with the girl cashier tan skin, black hair, the Hispanic or Indian girl with the yellow long press on nails?! Im sure you can single her out of the crowd. I wont say her name even though they all kept saying eachothers names out loud like it was high school musical back there. Is it mandatory for her to not give me my receipt? I , like many other hardworking Americans who have been coming here for as long as we all can remember,  need a receipt"; especially just incase how fast food workers forget to give us all of our order.. and wouldn't you know it, not only did they fail to give me my receipt,  but they failed to give me the correct order. I asked for my order more than three times! Is it also part of the owner's of McDonald's policy to berate the customer in Spanish? I'm Puerto Rican and I understand everything they was saying. How rude to have said all of that in front of the customer,  and about the customer.  Is this how you value your rewards members? I'm going to post about my experience on any social media platform! Mark my words! I would also like to state that the woman manager allowed her staff to keep acting maliciously and she acted as if nothing was going wrong. Is this how you run your establishment?!
The African American fellow, tall, with a kind of lisp, gave me again the wrong order and the wrong receipt. Must be nice to pick out the garbage a receipt from three hours ago to give to me, thinking i wouldnt know the difference! The owner should pop on in!! Must Like losing out on money.;
"Many thumbs down! I'm going to spend my money elsewhere. Zero stars!!!!!!"",1 star";
"1891,McDonald's,Fast food restaurant,""72-69 Kissena Blvd, Queens, NY 11367, United States"",40.7274006,-73.8124604,""2,193"",a year ago,""Place was busy..no chasier at the time. Just had to order in the kiosk or through the app. I ordered on my phone through the app and I got taken care of in a reasonable time. People who ordered on the kiosk and couldn't pay by card, had to wait for someone to collect the money at the cashier. With all the chaos, I want to say the team was handling it. Download the app on your phone and service will be faster. Also, the app does offer deals and free stuff with purchase."",4 stars";
"1892,McDonald's,Fast food restaurant,""72-69 Kissena Blvd, Queens, NY 11367, United States"",40.7274006,-73.8124604,""2,193"",a week ago,They are not 24hrs them doors are locked after 10pm & open at 630AM & Breakfast Ends at 10AM they just backwards,2 stars";
"1893,McDonald's,Fast food restaurant,""72-69 Kissena Blvd, Queens, NY 11367, United States"",40.7274006,-73.8124604,""2,193"",9 months ago,Best mcdonalds in the area but for some reason they charge a few cents more. Not a big deal but just something I noticed. The staff makes fries fresh forreal lol upon request. Nuggs are Hit or miss. But burgers are pretty good. Not a fan of the chicken products from here but the other mcodnalds on 86th and 20 has good chicken,4 stars";
"1894,McDonald's,Fast food restaurant,""72-69 Kissena Blvd, Queens, NY 11367, United States"",40.7274006,-73.8124604,""2,193"",5 months ago,Just the right amount of salt and fat  to raise my blood pressure and help clog my arteries.,5 stars";
"1895,McDonald's,Fast food restaurant,""72-69 Kissena Blvd, Queens, NY 11367, United States"",40.7274006,-73.8124604,""2,193"",7 months ago,I ordered a medium 2 cheeseburger meal they gave me cold fries I returned them & asked for fresh one they gave me another batch of cold fries haven't been back since i don't know who is allowing this to happen but it is extremely unexceptable,1 star";
"1896,McDonald's,Fast food restaurant,""72-69 Kissena Blvd, Queens, NY 11367, United States"",40.7274006,-73.8124604,""2,193"",a year ago,""Just left the drive through around 12:10 AM, the overnight crew is very unorganized. Iï¿½ï¿½ï¿½ï¿½ï¿½ï¿½ï¿½ï¿½ï¿½ï¿½ï¿½ï¿½ï¿½ï¿½ï¿½ï¿½ï¿½ï¿½ï¿½ï¿½ï¿½ï¿½ï¿½ï¿½ï¿½ï¿½ï¿½ve had issues on different occasions. Today, I was at the drive through for 5 mins waiting for someone to take my order, at this point I thought it was broken, so went to the first window, nobody was there, drove up to the second window, where I had to wave down a lady, and told her I was waiting for someone to take my order. She then starts going back and forth to another lady, who told her apparently that wasnï¿½ï¿½ï¿½ï¿½ï¿½ï¿½ï¿½ï¿½ï¿½ï¿½ï¿½ï¿½ï¿½ï¿½ï¿½ï¿½ï¿½ï¿½ï¿½ï¿½ï¿½ï¿½ï¿½ï¿½ï¿½ï¿½ï¿½t true. They stayed going back and forth until I had to wave down another worker walking by. He came up, I told him what happened and he said the worker was in the bathroom and to go back around. Now thereï¿½ï¿½ï¿½ï¿½ï¿½ï¿½ï¿½ï¿½ï¿½ï¿½ï¿½ï¿½ï¿½ï¿½ï¿½ï¿½ï¿½ï¿½ï¿½ï¿½ï¿½ï¿½ï¿½ï¿½ï¿½ï¿½ï¿½s 3 more cars in front of me putting "",1 star";
"1897,McDonald's,Fast food restaurant,""72-69 Kissena Blvd, Queens, NY 11367, United States"",40.7274006,-73.8124604,""2,193"",a week ago,The morning shift is very racist and racially profiling,1 star";
"1898,McDonald's,Fast food restaurant,""72-69 Kissena Blvd, Queens, NY 11367, United States"",40.7274006,-73.8124604,""2,193"",a year ago,Only one burger on my Big Mac ? Cmon ï¿½ï¿½ï¿½ï¿½,1 star";
"1899,McDonald's,Fast food restaurant,""72-69 Kissena Blvd, Queens, NY 11367, United States"",40.7274006,-73.8124604,""2,193"",7 months ago,The food was amazing I love it I mean the lady who was cleaning was being rude but besides that it was great,5 stars";
"1900,McDonald's,Fast food restaurant,""72-69 Kissena Blvd, Queens, NY 11367, United States"",40.7274006,-73.8124604,""2,193"",a year ago,""The worst mcdonalds you can ever come to.  They never know what people order, they put wrong food in the wrong bags, they have trouble following special instructions, and you'll be you'll be lucky if you deal with a nice cashier. I'm allergic to many things and had asked the cashier to make sure she did not put those products in my birth lose products in my Burger, however everything I named was in my Burger my Burger rather than out of my Burger.. These employees will fight with you until you are out of breath, they never admit they're wrong. And the coffee here is always made incorrectly I don't understand why. I make sure I drive past this McDonald's and go to another one. Although I don't eat fast food much, But if I ever do definitely not going to this McDonald's ever again."",1 star";
"1901,McDonald's,Fast food restaurant,""72-69 Kissena Blvd, Queens, NY 11367, United States"",40.7274006,-73.8124604,""2,193"",a year ago,""Very rude and nasty people at the inside counter";" no help or patience for people who are old and not computer savvy. At the drive through, they messed up my order and charged me for what I hadn't ordered. The lady manager was nice though."",1 star"
"1902,McDonald's,Fast food restaurant,""72-69 Kissena Blvd, Queens, NY 11367, United States"",40.7274006,-73.8124604,""2,193"",2 months ago,They said theyï¿½ï¿½ï¿½ï¿½ï¿½ï¿½ï¿½ï¿½ï¿½ï¿½ï¿½ï¿½ï¿½ï¿½ï¿½ï¿½ï¿½ï¿,1 star";
"1903,McDonald's,Fast food restaurant,""72-69 Kissena Blvd, Queens, NY 11367, United States"",40.7274006,-73.8124604,""2,193"",4 years ago,""The place seems cool, actually isnï¿½ï¿½ï¿½ï¿½ï¿½ï¿½ï¿½ï¿½ï¿½ï¿½ï¿½ï¿½ï¿½ï¿½ï¿½ï¿½ï¿½ï¿½ï¿½ï¿½ï¿½ï¿½ï¿½ï¿½ï¿½ï¿½ï¿½t bad as other M"",4 stars";
"1904,McDonald's,Fast food restaurant,""72-69 Kissena Blvd, Queens, NY 11367, United States"",40.7274006,-73.8124604,""2,193"",4 months ago,Pretty good. About what you expect from a McDonald's ï¿½ï¿½ï¿,4 stars";
"1905,McDonald's,Fast food restaurant,""72-69 Kissena Blvd, Queens, NY 11367, United States"",40.7274006,-73.8124604,""2,193"",a year ago,Ordered pick up and when I got home realized 3 items were missing almost half the order. How you complete an order and not make sure you're putting everything the customer paid for. Never ordering from here.,1 star";
"1906,McDonald's,Fast food restaurant,""72-69 Kissena Blvd, Queens, NY 11367, United States"",40.7274006,-73.8124604,""2,193"",7 months ago,After renovation this place has become one of the newer McDonalds around. Things have also gotten busier but that means fresher food.,5 stars";
"1907,McDonald's,Fast food restaurant,""72-69 Kissena Blvd, Queens, NY 11367, United States"",40.7274006,-73.8124604,""2,193"",a month ago,""Morning afternoon or night, they never have frappes"",1 star";
"1908,McDonald's,Fast food restaurant,""72-69 Kissena Blvd, Queens, NY 11367, United States"",40.7274006,-73.8124604,""2,193"",5 months ago,""Why does it say 24/7 dine in if they lock the doors after 1 am";
"Rubbish description and I'm FREEZING"",1 star";
